Article Title,Species,Main Topic,Secondary Topics,Article URL,Author,Entry ID,Tags
What is Cat Grass? | The Best Cat Grass Grow Kits,Cat,Nutrition,"treats-food-toppers, food-treats-feeders",https://thewildest.com/cat-nutrition/cat-grass,Kellie Gormly,5n5pvDhubvvBvh9Mo6cgUN,"cat, kitten, cat health, kitten health, cat products, cat nutrition"
Finding the Right Diet for Your Diabetic Cat,Cat,Nutrition,"food, food-treats-feeders",https://thewildest.com/cat-nutrition/diabetic-cat-food,Helin Jung,79P5MyPIzEU65k4s9Z12CY,"cat, cat health, cat food, cat nutrition, senior cat, cat products"
Is Your Cat Overweight?,Cat,Nutrition,weight-management,https://thewildest.com/cat-nutrition/how-heavy-should-my-cat-be,Jodi Helmer,7oVKu5Ux3rcmXEBUNIUL0T,"cat, cat health, cat food, cat nutrition, cat lifestyle"
How Much Should You Feed Your Cat?,Cat,Nutrition,weight-management,https://thewildest.com/cat-nutrition/how-much-to-feed-a-cat,Jodi Helmer,338g3dXlUzcGtDBXhmVIBK,"cat, cat health, cat food, kitten food, cat nutrition, new cat"
The 10 Best Meal Toppers to Increase Your Cat’s Appetite,Cat,Nutrition,"food, food-treats-feeders",https://thewildest.com/cat-nutrition/meal-toppers-for-cats,Avery Felman,YEMcs4OO135yX1bjbwC4a,"cat, cat food, cat nutrition, cat products, cat wellness"
Behind the Brand: Cat Person,Cat,Nutrition,"food, food-treats-feeders, treats-food-toppers",https://thewildest.com/cat-nutrition/cat-person,Bailey Freeman,79nj5mZ4v2hMPLxFa8eYw6,"cat, kitten, cat food, kitten food, cat products, cat nutrition, cat toys, behind the brand"
"At Bobby Flay’s Cat Food Brand, Made By Nacho, Kitties Call the Shots",Cat,Nutrition,"food-treats-feeders, sustainability, food, treats-food-toppers",https://thewildest.com/cat-nutrition/bobby-flay-made-by-nacho,Sean Zucker,5YdMXvqbgwWF9PzdXDdM5y,"cat, cat food, cat health, cat nutrition, cat products, behind the brand"
Natural and Organic Cat Treats Your Feline Will Love,Cat,Nutrition,"treats-food-toppers, food-treats-feeders",https://thewildest.com/cat-nutrition/natural-sustainable-cat-treats,Avery Felman,4cDjtPx4hVQV61ChMXOvmd,"cat, cat food, cat products, sustainable, cat nutrition, cat health, cat vitamins/supplements, cat wellness, kitten, kitten health, new cat, senior cat"
6 Best Fresh Food Delivery Services for Cats,Cat,Nutrition,"food, food-treats-feeders",https://thewildest.com/cat-nutrition/best-delivery-cat-food-services,Avery Felman,3LWWIvMP0wvennJKJW8E9Z,"cat, cat food, cat products, cat nutrition, kitten food, senior cat, new cat, cat health"
Is Grain-Free Cat Food Right for Your Pet?,Cat,Nutrition,food,https://thewildest.com/cat-nutrition/grain-free-cat-food,Helin Jung,4nPl76bGwpE677YFUtMISp,"cat, cat health, cat nutrition, cat food, kitten, new cat, kitten food, senior cat"
The Best Fish Oils for Cats,Cat,Nutrition,"vitamins-supplements, health-grooming",https://thewildest.com/cat-nutrition/fish-oil-for-cats,Avery Felman,3yuI71sb2e3ygAkZUnIuQQ,"cat, cat nutrition, cat vitamins/supplements, cat products, cat health, kitten, senior cat"
Can Cats Eat Cheese?,Cat,Nutrition,"food, recipes",https://thewildest.com/cat-nutrition/can-cats-eat-cheese,Jodi Helmer,7Aih6TY74lkvV2YVPBOijF,"cat, cat food, cat nutrition, cat safety, can my cat eat this?"
Can My Cat Eat Bananas?,Cat,Nutrition,treats-food-toppers,https://thewildest.com/cat-nutrition/can-cats-eat-bananas,Jodi Helmer,56kgQILaTyFNPTfTkMna5X,"can my cat eat this?, cat, cat food, cat nutrition, cat safety"
Why is My Cat Not Eating? | Causes and Solutions for Picky Eaters,Cat,Nutrition,"food, conditions-treatments, adoption-fostering",https://thewildest.com/cat-nutrition/cat-not-eating,Kate Sheofsky,1xhJxNXmMvCY10WwbNtATI,"cat behavior, cat, cat food, cat health, cat nutrition, kitten, kitten food, kitten health, new cat, senior cat"
Is Homemade Cat Food Better Than Kibble and Canned?,Cat,Nutrition,food,https://thewildest.com/cat-nutrition/homemade-cat-food,Jodi Helmer,61IvraD5F7DIp2iJTxJnm4,"cat, cat food, cat nutrition, cat health, kitten, kitten food, new cat, senior cat"
Raw Food Diets for Cats: An Explainer,Cat,Nutrition,food,https://thewildest.com/cat-nutrition/raw-food-for-cats,Kate Sheofsky,2D7ul9Fnzehvp1jGKEbh4M,"cat, cat food, cat nutrition, kitten, new cat, senior cat"
Why is My Senior Cat Suddenly a Picky Eater?,Cat,Nutrition,food,https://thewildest.com/cat-nutrition/warm-up-cat-food-picky-eater,"Scott McGrane, PhD",5kGRdP8m4MmxP0bx6D3844,"cat, cat behavior, cat food, cat nutrition, senior cat"
Are Cats Picky Eaters or Feline Foodies?,Cat,Nutrition,food,https://thewildest.com/cat-nutrition/cats-and-kokumi,"Dr. Anni Laffitte, PhD",1NUqJRI6Vdfnp4shxWdPp8,"cat, cat behavior, cat food, cat nutrition"
Can Cats Eat Blueberries?,Cat,Nutrition,"treats-food-toppers, recipes",https://thewildest.com/cat-nutrition/can-cats-eat-blueberries,Jodi Helmer,aHpO1pSynh88eKaoPUTtg,"cat, cat food, cat health, cat nutrition, cat safety, recipes, can my cat eat this?"
Can Cats Eat Dog Food?,Cat,Nutrition,"food, safety",https://thewildest.com/cat-nutrition/can-cats-eat-dog-food,Jodi Helmer,20p5rdBeOOR7bhN0yKDjHh,"cat, cat food, cat nutrition, cat safety, cat health, kitten food, kitten, senior cat, can my cat eat this?"
Can My Cat Eat Watermelon?,Cat,Nutrition,treats-food-toppers,https://thewildest.com/cat-nutrition/can-cats-eat-watermelon,Jodi Helmer,5e79e40GDo4qvk4VUGD25W,"cat, cat food, cat health, cat nutrition, cat safety, summer, can my cat eat this?"
Can My Cat Eat Avocado?,Cat,Nutrition,"treats-food-toppers, safety",https://thewildest.com/cat-nutrition/can-cats-eat-avocado,Jodi Helmer,60prHmo6WNQ2fHDHxaaph7,"can my cat eat this?, cat, cat food, cat nutrition, cat safety"
9 Foods Toxic to Cats,Cat,Nutrition,"food, safety, emergencies",https://thewildest.com/cat-nutrition/9-foods-toxic-to-cats,Jodi Helmer,4TuOGDYZO4pYuDYJsczYqM,"cat, cat food, cat health, cat nutrition, cat safety, kitten, new cat, senior cat"
9 Human Foods That Are Safe for Cats,Cat,Nutrition,"food, treats-food-toppers",https://thewildest.com/cat-nutrition/human-foods-safe-for-cats,Jodi Helmer,1fkTD8SWMqxXncz1uEGOQq,"cat, cat food, cat health, cat nutrition, cat safety, new cat, kitten food, kitten, senior cat"
Can Cats Eat Strawberries?,Cat,Nutrition,"recipes, treats-food-toppers",https://thewildest.com/cat-nutrition/can-cats-eat-strawberries,Jodi Helmer,tElNqKcprjrf8y2FmqnTf,"cat, cat food, cat health, cat nutrition, cat safety, can my cat eat this?"
Can Cats Eat Bread?,Cat,Nutrition,food,https://thewildest.com/cat-nutrition/can-cats-eat-bread,Jodi Helmer,6AskuHocB48f5BroMdbkPM,"cat, cat food, cat nutrition, cat safety, can my cat eat this?"
Cat Food 101: How to Pick the Right Food for Your Cat,Cat,Nutrition,food,https://thewildest.com/cat-nutrition/how-to-choose-cat-food,Jodi Helmer,1rQ4wJNlZysTxE0Rsr8H1a,"cat, cat food, cat health, cat nutrition, kitten health, kitten, kitten food, senior cat"